<?xml version="1.0" encoding="UTF-8"?>
<tns:job xmlns:tns="http://martinkampjensen.com/thesis/job"
	xmlns:xsi="http://www.w3.org/2001/XMLSchema-instance"
	xsi:schemaLocation="http://martinkampjensen.com/thesis/job job.xsd"
	version="1.0">
	<name>Minimization example</name>
	<input>
		<type>pdb</type>
		<location>gromacs\AcAlaNMe_gmx.pdb</location>
	</input>
	<action>minimize</action>
	<options>
		<seed></seed>
		<minimization>
			<minimizer></minimizer>
			<minima>3</minima>
		</minimization>
	</options>
</tns:job>
